{
  "schema_version": "1.1",
  "project": {
    "slug": "review-test",
    "name": "Review Test",
    "created_at": "2026-07-30T03:43:01Z",
    "updated_at": "2026-07-30T03:43:01Z"
  },
  "position": {
    "module": "canvas-mapper",
    "atom_id": "C01",
    "status": "in_progress"
  },
  "answers": [],
  "evidence": [],
  "assumptions": [],
  "decisions": [],
  "unknowns": [],
  "artifacts": [],
  "ledger": {
    "phase": "Phase 1: Canvas-Mapper",
    "active_module": "canvas-mapper",
    "completion_pct": 0,
    "validation_milestone": "None",
    "unvalidated_bombs": []
  }
}
