{
  "schema_version": "1.0",
  "project": {
    "slug": "valutest-live-create",
    "name": "Valutest Live Create",
    "created_at": "2026-07-18T20:01:27Z",
    "updated_at": "2026-07-18T20:01:27Z"
  },
  "position": {
    "module": "profile",
    "atom_id": "P01",
    "status": "in_progress"
  },
  "answers": [],
  "evidence": [],
  "assumptions": [],
  "decisions": [],
  "unknowns": [],
  "artifacts": [],
  "ledger": {
    "phase": "Canvas",
    "active_module": "profile",
    "completion_pct": 0,
    "validation_milestone": "None",
    "unvalidated_bombs": []
  }
}
